<?xml version="1.0" encoding="UTF-8"?>
<!-- This file is used for xml-files which install, update or delete pages. -->
<xs:schema xmlns:xs="http://www.w3.org/2001/XMLSchema" xmlns="http://www.woltlab.com" targetNamespace="http://www.woltlab.com" elementFormDefault="qualified">
	<!-- include types -->
	<xs:include schemaLocation="types.xsd" />
	
	<!-- data element -->
	<xs:element name="data">
		<xs:complexType>
			<xs:all>
				<xs:element name="import" type="import" minOccurs="0" />
				<xs:element name="delete" type="delete" minOccurs="0" />
			</xs:all>
		</xs:complexType>
	</xs:element>
	
	<!-- import element -->
	<xs:complexType name="import">
		<xs:sequence>
			<xs:element name="item" type="item_import" maxOccurs="unbounded" />
		</xs:sequence>
	</xs:complexType>
	
	<!-- delete element -->
	<xs:complexType name="delete">
		<xs:sequence>
			<xs:element name="item" type="item_delete" maxOccurs="unbounded" />
		</xs:sequence>
	</xs:complexType>
	
	<!-- deleted menu item -->
	<xs:complexType name="item_delete">
		<xs:attribute name="identifier" type="woltlab_varchar" use="required" />
	</xs:complexType>
	
	<!-- imported/updated menu item -->
	<xs:complexType name="item_import">
		<xs:complexContent>
			<xs:extension base="item_delete">
				<xs:choice maxOccurs="unbounded">
					<xs:element name="title" type="title_element" minOccurs="1" maxOccurs="unbounded" />
					<xs:element name="menu" type="woltlab_varchar" minOccurs="1" maxOccurs="1" />
					<xs:element name="page" type="woltlab_varchar" minOccurs="1" maxOccurs="1" />
					<xs:element name="parent" type="woltlab_varchar" minOccurs="0" maxOccurs="1" />
					<xs:element name="externalURL" type="woltlab_varchar" minOccurs="0" maxOccurs="1" />
					<xs:element name="urlParameters" type="woltlab_varchar" minOccurs="0" maxOccurs="1" />
				</xs:choice>
			</xs:extension>
		</xs:complexContent>
	</xs:complexType>
	
	<!-- title element -->
	<xs:complexType name="title_element">
		<xs:simpleContent>
			<xs:extension base="woltlab_varchar">
				<xs:attribute name="language" type="woltlab_varchar" use="optional" />
			</xs:extension>
		</xs:simpleContent>
	</xs:complexType>
</xs:schema>
