<?xml version="1.0" encoding="UTF-8"?>
<data xmlns="http://www.woltlab.com" xmlns:xsi="http://www.w3.org/2001/XMLSchema-instance" xsi:schemaLocation="http://www.woltlab.com http://www.woltlab.com/XSD/6.0/menuItem.xsd">
	<import>
		<item identifier="com.woltlab.wcf.Dashboard">
			<menu>com.woltlab.wcf.MainMenu</menu>
			<title language="de">Dashboard</title>
			<title language="en">Dashboard</title>
			<page>com.woltlab.wcf.Dashboard</page>
		</item>
		<item identifier="com.woltlab.wcf.ArticleList">
			<menu>com.woltlab.wcf.MainMenu</menu>
			<title language="de">Artikel</title>
			<title language="en">Articles</title>
			<page>com.woltlab.wcf.ArticleList</page>
		</item>
		<item identifier="com.woltlab.wcf.UnreadArticleList">
			<parent>com.woltlab.wcf.ArticleList</parent>
			<title language="de">Ungelesene Artikel</title>
			<title language="en">Unread Articles</title>
			<page>com.woltlab.wcf.UnreadArticleList</page>
		</item>
		<item identifier="com.woltlab.wcf.WatchedArticleList">
			<parent>com.woltlab.wcf.ArticleList</parent>
			<title language="de">Abonnierte Artikel</title>
			<title language="en">Subscribed Articles</title>
			<page>com.woltlab.wcf.WatchedArticleList</page>
		</item>
		<item identifier="com.woltlab.wcf.MembersList">
			<menu>com.woltlab.wcf.MainMenu</menu>
			<title language="de">Mitglieder</title>
			<title language="en">Members</title>
			<page>com.woltlab.wcf.MembersList</page>
		</item>
		<item identifier="com.woltlab.wcf.RecentActivityList">
			<parent>com.woltlab.wcf.MembersList</parent>
			<title language="de">Letzte Aktivitäten</title>
			<title language="en">Recent Activity</title>
			<page>com.woltlab.wcf.RecentActivityList</page>
		</item>
		<item identifier="com.woltlab.wcf.UsersOnlineList">
			<parent>com.woltlab.wcf.MembersList</parent>
			<title language="de">Benutzer online</title>
			<title language="en">Users Online</title>
			<page>com.woltlab.wcf.UsersOnlineList</page>
		</item>
		<item identifier="com.woltlab.wcf.Team">
			<parent>com.woltlab.wcf.MembersList</parent>
			<title language="de">Team</title>
			<title language="en">Staff</title>
			<page>com.woltlab.wcf.Team</page>
		</item>
		<item identifier="com.woltlab.wcf.PrivacyPolicy">
			<menu>com.woltlab.wcf.FooterMenu</menu>
			<title language="de">Datenschutzerklärung</title>
			<title language="en">Privacy Policy</title>
			<page>com.woltlab.wcf.PrivacyPolicy</page>
		</item>
		<item identifier="com.woltlab.wcf.Contact">
			<menu>com.woltlab.wcf.FooterMenu</menu>
			<title language="de">Kontakt</title>
			<title language="en">Contact</title>
			<page>com.woltlab.wcf.Contact</page>
		</item>
	</import>
</data>
